{
  "schemaVersion": "1.0",
  "contentVersion": "2026.08.10.2",
  "page": {
    "id": "classroom-explorations-hub",
    "title": "Classroom Explorations",
    "summary": "A museum-style doorway into current classroom explorations, This Week We Learned recaps, and school-year archives.",
    "routeUrl": "https://rmhughes.edublogs.org/classroom-explorations/",
    "currentSchoolYear": "2026-2027",
    "theme": "discovery-museum"
  },
  "schoolYears": [
    {
      "id": "2026-2027",
      "display": "2026–2027",
      "status": "current",
      "order": 10
    },
    {
      "id": "2025-2026",
      "display": "2025–2026",
      "status": "archived",
      "order": 20
    }
  ],
  "records": [
    {
      "id": "welcome-classroom-explorations",
      "type": "video",
      "status": "current",
      "schoolYear": "2026-2027",
      "title": "Welcome to Classroom Explorations",
      "summary": "A quick tour of how we explore, document, and share discoveries.",
      "pageUrl": "https://www.youtube.com/watch?v=AR1cSKxxSmU",
      "imageUrl": null,
      "imageAlt": null,
      "emoji": "🎥",
      "theme": "welcome-theater",
      "animation": "gentle-glow",
      "order": 5,
      "dates": {},
      "media": {
        "kind": "youtube",
        "sourceUrl": "https://www.youtube.com/watch?v=AR1cSKxxSmU",
        "embedUrl": "https://www.youtube-nocookie.com/embed/AR1cSKxxSmU"
      },
      "completeness": "complete"
    },
    {
      "id": "summer-bloom-adoption-project",
      "type": "exploration",
      "status": "current",
      "schoolYear": "2026-2027",
      "title": "Summer Bloom Adoption Project",
      "summary": "Step into the zinnia greenhouse as students raise mystery seedlings, observe their growth, and discover what each unique bloom becomes.",
      "pageUrl": "https://rmhughes.edublogs.org/zinnia-page/",
      "imageUrl": "https://images.squarespace-cdn.com/content/v1/65397b8c01ff584e2d7834e3/ee61742a-ec98-449f-9475-53a345566da7/IMG_2850.jpg?format=750w",
      "imageAlt": "Featured image for the Summer Bloom Adoption Project.",
      "emoji": "🌸",
      "theme": "garden-green",
      "animation": "garden-glow",
      "order": 10,
      "dates": {},
      "learningPoints": [
        "Zinnia seedlings and plant care",
        "Observation journals and field notes",
        "Mystery bloom reveals"
      ],
      "completeness": "complete"
    },
    {
      "id": "twwl-current-2026-2027",
      "type": "twwl",
      "status": "coming-soon",
      "schoolYear": "2026-2027",
      "title": "This Week We Learned",
      "summary": "The first approved 2026–2027 classroom recap will appear here when it is ready.",
      "pageUrl": null,
      "imageUrl": null,
      "imageAlt": null,
      "emoji": "📚",
      "theme": "learning-purple",
      "animation": "lantern-soft",
      "order": 20,
      "dates": {},
      "completeness": "not-applicable"
    },
    {
      "id": "archive-2025-2026",
      "type": "archive-doorway",
      "status": "coming-soon",
      "schoolYear": "2025-2026",
      "title": "Last Year Content",
      "summary": "The 2025–2026 Explorations and learning recaps will live behind this doorway as they are converted to the permanent system.",
      "pageUrl": null,
      "imageUrl": null,
      "imageAlt": null,
      "emoji": "🏛️",
      "theme": "archive-crystal",
      "animation": "crystalline-door",
      "order": 90,
      "dates": {},
      "archiveSchoolYear": "2025-2026",
      "completeness": "not-applicable"
    }
  ]
}
